"campaign","ad_group","landing_url","path1","path2","headline_1","headline_2","headline_3","headline_4","headline_5","headline_6","headline_7","headline_8","headline_9","headline_10","headline_11","headline_12","headline_13","headline_14","headline_15","description_1","description_2","description_3","description_4","notes"
"Studio Search - Gather Extract","PDF and data cleanup","https://webot.studio/?utm_source=google&utm_medium=cpc&utm_campaign=studio_search_gather_extract&utm_content=rsa_v1","data","cleanup","PDFs To Clean Sheets","Messy Files, Fixed","Reviewed Data Cleanup","Invoice Extraction Help","Web Research Packs","Source Notes Included","OCR Cleanup Service","Human-Reviewed Output","Turn PDFs Into Tables","Fast Reviewed Jobs","Small Jobs From $49","Clean Exports Delivered","Upload Files, Get Order","WeBot Gather Extract","No More Manual Cleanup","Send PDFs, invoices, screenshots, or links. Get clean tables and source notes.","Reviewed AI-assisted cleanup for small jobs, standard jobs, and deeper projects.","WeBot routes work, drafts output, then runs lead and fresh-context review.","Start with a one-time reviewed job or monthly Studio access.","Best first search campaign. Mirror to Microsoft Ads with source changed to microsoft."
"Studio Search - Build Automate","Code spreadsheet automation","https://webot.studio/?utm_source=google&utm_medium=cpc&utm_campaign=studio_search_build_automate&utm_content=rsa_v1","code","automation","Fix Scripts And Sheets","Automation Help Fast","Code Review With AI","Spreadsheet Formula Help","Reviewed Technical Work","AI Workflow Build Help","Engineer-Ready Notes","Turn Tasks Into Runbooks","Debug The Workflow","Tech Jobs From $49","Build And Automate","Ship Useful Automation","Human-Reviewed Drafts","Practical Code Help","WeBot Studio Tech Help","Send a script, sheet, or workflow idea. Get reviewed fixes, notes, and next steps.","AI-assisted technical drafts with lead review and fresh-context quality checks.","For formulas, code review, automation runbooks, and practical implementation help.","Choose a one-time reviewed job or ongoing monthly access in WeBot Studio.","Higher CPC likely. Start exact and phrase before broad."
"Studio Search - Plan Itinerary","Trip date road trip planning","https://webot.studio/?utm_source=google&utm_medium=cpc&utm_campaign=studio_search_plan_itinerary&utm_content=rsa_v1","plans","itinerary","Custom Trip Itineraries","Date Night Planned","Road Trip Planning Help","Business Event Plans","Reviewed Travel Plans","Backup Ideas Included","Reservation Checklists","Plan And Itinerary","Small Plans From $49","Kid-Friendly Trip Plans","Rain Backup Plans","Host Checklist Help","Trip Plans, Reviewed","Weekend Plans Made","Routes, Meals, Timing","Get a reviewed plan for vacations, date nights, road trips, or business gatherings.","Share dates, budget, group needs, and pace. WeBot returns a practical plan.","Includes routes, timing, reservation prompts, backup ideas, and supply notes.","Start with a one-time reviewed job in WeBot Studio.","Good for Meta too, but search intent is clearer on custom itinerary terms."
"Studio Search - Review Decide","Research briefs comparisons","https://webot.studio/?utm_source=google&utm_medium=cpc&utm_campaign=studio_search_review_decide&utm_content=rsa_v1","research","briefs","Vendor Comparison Help","Decision Memos Fast","Research Briefs Reviewed","Compare Options Clearly","Fact-Checked Summaries","Executive Brief Help","Review And Decide","Source-Backed Research","Second Opinion Desk","Business Research Help","Turn Notes Into Memos","Fresh-Context Review","Small Briefs From $49","Clear Tradeoff Notes","WeBot Research Desk","Send links, notes, or options. Get a reviewed brief with tradeoffs and next steps.","Useful for vendor comparisons, executive summaries, and fact-check packs.","AI-assisted research with source notes, lead review, and fresh-context review.","Choose a one-time reviewed job or monthly Studio access.","Strong for B2B search and LinkedIn retargeting later."
"Studio Search - Create Polish","Copy cards brand concepts","https://webot.studio/?utm_source=google&utm_medium=cpc&utm_campaign=studio_search_create_polish&utm_content=rsa_v1","copy","creative","Cards Copy Brand Help","Business Card Concepts","Logo Direction Help","Social Posts Reviewed","Polished Copy Fast","Thank-You Cards Done","Create And Polish","Brand Notes From $49","Human-Reviewed Copy","Simple Creative Help","Emails Posts Cards","Tone Rewrites Help","Print Notes Included","Starter Brand Concepts","WeBot Creative Desk","Get reviewed copy, cards, social posts, logo direction, or business-card concepts.","Share tone, audience, and details. WeBot drafts, reviews, and packages the result.","Good for thank-you cards, business cards, simple brand notes, and short copy.","Start with a one-time reviewed creative job or monthly Studio access.","Avoid expensive generic logo keywords at first."
